<?xml version="1.0" encoding="utf-8" ?>
<!--
========================================================================
   Copyright(c) 2018 Qualcomm Technologies, Inc.
   All Rights Reserved.
   Confidential and Proprietary - Qualcomm Technologies, Inc.
========================================================================
-->
<StreamConfig xmlns:xsi="http://www.w3.org/2001/XMLSchema-instance" xsi:noNamespaceSchemaLocation="..\XSD\stream_config.xsd">
  <module_version major_revision="1" minor_revision="0" incr_revision="0"/>
  <Width>1920</Width>
  <Height>1080</Height>
  <Stride>2592</Stride>
  <BayerPattern>1</BayerPattern>
  <BitsPerPixel>10</BitsPerPixel>
  <PackedType>0</PackedType>
  <yuvFormatType>2</yuvFormatType>
  <IOT>
	<input_bayer_format>1</input_bayer_format>
	<output_bayer_format>0</output_bayer_format>
	<sensor_layout>2</sensor_layout>
	<frame_count>2</frame_count>
	<line_offset>618</line_offset>
	<sensor_line_info>0</sensor_line_info>	
  </IOT>
</StreamConfig>
